,Gene_set,Term,Overlap,P-value,Adjusted P-value,Old P-value,Old Adjusted P-value,Odds Ratio,Combined Score,Genes
0,GO_Biological_Process_2023,T Cell Activation,0.09009009,7.58E-09,1.02E-05,0,0,14.5965716,272.9270981,PPP3CA;CD84;PTPRC;CASP8;JAML;TRBC2;RAB29;PTPN22;GATA3;TRGC2
1,GO_Biological_Process_2023,Positive Regulation Of Intracellular Signal Transduction,0.03047619,1.26E-06,0.000835265,0,0,4.751227898,64.53247059,ITGB1;TRAT1;TRADD;GATA3;AKAP13;DOK2;PTPRC;CASP8;CCL5;CCL4;CPNE1;FLNA;CARD16;TRIM38;FNIP1;LIMS1
3,GO_Biological_Process_2023,Regulation Of T Cell Receptor Signaling Pathway,0.147058824,4.24E-06,0.001425962,0,0,24.59315306,304.2177944,LGALS3;TRAT1;RAB29;PTPN22;CD226
2,GO_Biological_Process_2023,Positive Regulation Of Calcium Ion Transport,0.172413793,1.86E-06,0.000835265,0,0,29.72422062,392.1384119,LGALS3;STIM2;CCL5;CCL4;ATP2B1
4,GO_Biological_Process_2023,T Cell Receptor Signaling Pathway,0.073684211,5.64E-06,0.001516869,0,0,11.4777704,138.7097118,PTPRC;TRBC2;INPP5D;PTPN22;FYN;GATA3;TRGC2
5,GO_Biological_Process_2023,Positive Regulation Of Antigen Receptor-Mediated Signaling Pathway,0.2,1.14E-05,0.002404905,0,0,35.42857143,403.195006,PTPRC;TRAT1;RAB29;CD226
6,GO_Biological_Process_2023,Inhibition Of Cysteine-Type Endopeptidase Activity,0.428571429,1.25E-05,0.002404905,0,0,105.5957447,1191.937328,CARD8;CARD16;CST7
7,GO_Biological_Process_2023,Regulation Of Innate Immune Response,0.076923077,2.10E-05,0.00353571,0,0,11.9468599,128.6534068,GBP5;CASP8;CCL5;PTPN22;LYAR;ATG12
8,GO_Biological_Process_2023,Negative Regulation Of Cysteine-Type Endopeptidase Activity,0.094339623,3.92E-05,0.005780559,0,0,14.8441247,150.6148899,RPS6KA3;CARD8;CARD16;CST7;FNIP1
9,GO_Biological_Process_2023,Lymphocyte Differentiation,0.065934066,5.06E-05,0.005780559,0,0,10.11304348,100.0359314,ITGB1;KLF6;PTPRC;PTPN22;GATA3;FNIP1
10,GO_Biological_Process_2023,Antigen Receptor-Mediated Signaling Pathway,0.052238806,5.31E-05,0.005780559,0,0,7.937410196,78.13137905,PTPRC;TRBC2;INPP5D;PTPN22;FYN;GATA3;TRGC2
11,GO_Biological_Process_2023,B Cell Activation,0.065217391,5.38E-05,0.005780559,0,0,9.994944388,98.2525094,ITGB1;KLF6;CASP8;PTPRC;AKAP17A;FNIP1
12,GO_Biological_Process_2023,Regulation Of Calcium Ion Transport,0.087719298,5.59E-05,0.005780559,0,0,13.69950194,134.1415643,CD84;STIM2;CCL5;CCL4;ATP2B1
13,GO_Biological_Process_2023,Positive Regulation Of T Cell Receptor Signaling Pathway,0.230769231,9.92E-05,0.009518892,0,0,42.22553191,389.2697903,TRAT1;RAB29;CD226
14,GO_Biological_Process_2023,Granulocyte Chemotaxis,0.068493151,0.000182905,0.01617574,0,0,10.4676259,90.09005326,LGALS3;ANXA1;JAML;CCL5;CCL4
15,GO_Biological_Process_2023,Positive Regulation Of Monoatomic Ion Transport,0.1,0.000192568,0.01617574,0,0,15.73015873,134.5724435,STIM2;CCL5;CCL4;ATP2B1
16,GO_Biological_Process_2023,Regulation Of Lymphocyte Proliferation,0.166666667,0.000275533,0.020315207,0,0,28.14326241,230.6848245,LGALS3;PTPN22;IKZF3
17,GO_Biological_Process_2023,Regulation Of I-kappaB kinase/NF-kappaB Signaling,0.034482759,0.0002826,0.020315207,0,0,5.155462185,42.12774808,AKAP13;CASP8;CARD8;TRADD;CPNE1;FLNA;CARD16;TRIM38
18,GO_Biological_Process_2023,Negative Regulation Of Response To Biotic Stimulus,0.088888889,0.00030532,0.020315207,0,0,13.80836237,111.7669607,CARD8;CARD16;LYAR;ATG12
19,GO_Biological_Process_2023,Regulation Of Cell Migration,0.025345622,0.000312196,0.020315207,0,0,3.799623171,30.67010001,ITGB1;SDCBP;PPP3CA;ANXA1;CITED2;TRADD;CCL5;ARID4A;FLNA;PRKX;FYN
20,GO_Biological_Process_2023,Regulation Of Integrin-Mediated Signaling Pathway,0.157894737,0.000325473,0.020315207,0,0,26.38297872,211.8613906,CD63;FLNA;LIMS1
21,GO_Biological_Process_2023,T Cell Differentiation,0.086956522,0.000332541,0.020315207,0,0,13.47891156,107.9492147,ANXA1;PTPRC;PTPN22;GATA3
22,GO_Biological_Process_2023,Cellular Defense Response,0.083333333,0.000392126,0.021959074,0,0,12.86493506,100.9116056,ITGB1;GNLY;TRAT1;PRF1
23,GO_Biological_Process_2023,Regulation Of Tumor Necrosis Factor-Mediated Signaling Pathway,0.083333333,0.000392126,0.021959074,0,0,12.86493506,100.9116056,CASP8;CARD8;CPNE1;CARD16
24,GO_Biological_Process_2023,Zymogen Inhibition,0.4,0.000507539,0.024439039,0,0,93.20657277,707.0591984,CARD8;CST7
25,GO_Biological_Process_2023,Kidney Morphogenesis,0.4,0.000507539,0.024439039,0,0,93.20657277,707.0591984,PPP3CA;PRKX
26,GO_Biological_Process_2023,Positive Regulation Of Vesicle Fusion,0.4,0.000507539,0.024439039,0,0,93.20657277,707.0591984,ANXA1;ANXA2
27,GO_Biological_Process_2023,Regulation Of Mononuclear Cell Migration,0.136363636,0.000509147,0.024439039,0,0,22.21388578,168.4428858,LGALS3;STK10;CCL5
28,GO_Biological_Process_2023,Eosinophil Chemotaxis,0.125,0.00066215,0.029664338,0,0,20.09625127,147.1049177,LGALS3;CCL5;CCL4
29,GO_Biological_Process_2023,Eosinophil Migration,0.125,0.00066215,0.029664338,0,0,20.09625127,147.1049177,LGALS3;CCL5;CCL4
30,GO_Biological_Process_2023,Regulation Of Natural Killer Cell Chemotaxis,0.333333333,0.000757713,0.031823931,0,0,69.90140845,502.2560429,CCL5;CCL4
31,GO_Biological_Process_2023,Regulation Of Antigen Receptor-Mediated Signaling Pathway,0.333333333,0.000757713,0.031823931,0,0,69.90140845,502.2560429,PTPRC;PTPN22
32,GO_Biological_Process_2023,Negative Regulation Of Cytokine-Mediated Signaling Pathway,0.06779661,0.000862768,0.035138176,0,0,10.28623377,72.57313427,PTPRC;CARD8;CARD16;PARP14
33,GO_Biological_Process_2023,Myeloid Cell Development,0.111111111,0.000941919,0.037233491,0,0,17.58156028,122.5011321,ANXA2;FLNA;LYAR
34,GO_Biological_Process_2023,Regulation Of T Cell Activation,0.064516129,0.001040019,0.038681195,0,0,9.75270936,66.98664202,LGALS3;CCL5;PTPN22;B2M
35,GO_Biological_Process_2023,Negative Regulation Of Signaling,0.107142857,0.001049414,0.038681195,0,0,16.87744681,115.7712469,PPP3CA;TRAT1;INPP5D
36,GO_Biological_Process_2023,Positive Regulation Of T Cell Activation,0.046728972,0.001064884,0.038681195,0,0,6.966426859,47.68442082,PTPRC;ANXA1;CCL5;GATA3;B2M
37,GO_Biological_Process_2023,Response To Tumor Necrosis Factor,0.046296296,0.001110199,0.039265979,0,0,6.898442411,46.93159503,CASP8;TRADD;CCL5;CCL4;GATA3
38,GO_Biological_Process_2023,Positive Regulation Of T Cell Proliferation,0.061538462,0.001241402,0.042780607,0,0,9.271662763,62.04146363,PPP3CA;ANXA1;PTPRC;CCL5
39,GO_Biological_Process_2023,Negative Regulation Of Immune Response,0.060606061,0.001314182,0.042796522,0,0,9.121658986,60.51801708,LGALS3;FYN;LYAR;ATG12
40,GO_Biological_Process_2023,Positive Regulation Of Cellular Component Organization,0.044247788,0.001358527,0.042796522,0,0,6.577404743,43.4197771,LGALS3;ANXA2;AHNAK;FNIP1;ADD1
41,GO_Biological_Process_2023,Regulation Of Interleukin-18 Production,0.25,0.001401077,0.042796522,0,0,46.59624413,306.1612892,GBP5;CD84
42,GO_Biological_Process_2023,Cellular Response To Muramyl Dipeptide,0.25,0.001401077,0.042796522,0,0,46.59624413,306.1612892,PTPN22;VIM
43,GO_Biological_Process_2023,Regulation Of Vesicle Fusion,0.25,0.001401077,0.042796522,0,0,46.59624413,306.1612892,ANXA1;ANXA2
44,GO_Biological_Process_2023,B Cell Differentiation,0.058823529,0.001468597,0.043862088,0,0,8.835714286,57.63932225,ITGB1;KLF6;PTPRC;FNIP1
45,GO_Biological_Process_2023,Neutrophil Chemotaxis,0.057142857,0.001635228,0.046848328,0,0,8.567099567,54.96628176,LGALS3;JAML;CCL5;CCL4
46,GO_Biological_Process_2023,Positive Regulation Of I-kappaB kinase/NF-kappaB Signaling,0.034285714,0.00169648,0.046848328,0,0,5.06483149,32.30957197,AKAP13;CASP8;TRADD;FLNA;CARD16;TRIM38
47,GO_Biological_Process_2023,Regulation Of NLRP3 Inflammasome Complex Assembly,0.090909091,0.001702412,0.046848328,0,0,14.06099291,89.64880465,GBP5;CARD8;PTPN22
48,GO_Biological_Process_2023,Cellular Response To Tumor Necrosis Factor,0.042016807,0.001708012,0.046848328,0,0,6.229332324,39.6959542,TRADD;CCL5;CCL4;GATA3;LIMS1
49,GO_Biological_Process_2023,Skeletal Muscle Tissue Regeneration,0.222222222,0.001792888,0.048192831,0,0,39.93762575,252.5626509,PPP3CA;ANXA1
50,GO_Biological_Process_2023,Negative Regulation Of Cytokine Production,0.033707865,0.00184874,0.048719724,0,0,4.975733064,31.31353816,CD84;ANXA1;PTPRC;PTPN22;ATP2B1;ATG12
